{
  "version": "v2",
  "owner": "codex",
  "intent": "persistent_session_guardrails_and_execution_queue",
  "statusEnum": ["pending", "in_progress", "blocked", "completed"],
  "priorityPolicy": {
    "alwaysRunBeforeAnyTask": [
      "GUARD-PATH-001",
      "GUARD-VERIFY-001",
      "GUARD-REPORT-001",
      "GUARD-FOUNDATION-001"
    ],
    "rule": "Any blocking guard failure stops implementation and final closeout."
  },
  "tasks": [
    {
      "id": "GUARD-PATH-001",
      "kind": "guard",
      "title": "Path guard before write",
      "status": "in_progress",
      "blocking": true,
      "scope": "codex_only",
      "owner": "codex",
      "checks": [
        {
          "command": "powershell -ExecutionPolicy Bypass -File Xuanzhi-Dev/testing/scripts/validate-execution-guardrails.ps1 -AsJson",
          "passWhen": "newRepoRootFiles=0 && testFilesOutsideTestingRoot=0 && emptyNewFiles=0"
        }
      ]
    },
    {
      "id": "GUARD-VERIFY-001",
      "kind": "guard",
      "title": "Verification guard (no smoke-only closure)",
      "status": "in_progress",
      "blocking": true,
      "scope": "codex_only",
      "owner": "codex",
      "checks": [
        {
          "command": "powershell -ExecutionPolicy Bypass -File Xuanzhi-Dev/testing/scripts/validate-execution-guardrails.ps1 -ReportPath <REPORT_PATH> -AsJson",
          "passWhen": "if smoke marker exists then real verification evidence marker must exist"
        }
      ]
    },
    {
      "id": "GUARD-REPORT-001",
      "kind": "guard",
      "title": "Report guard (three required sections)",
      "status": "in_progress",
      "blocking": true,
      "scope": "codex_only",
      "owner": "codex",
      "checks": [
        {
          "command": "powershell -ExecutionPolicy Bypass -File Xuanzhi-Dev/testing/scripts/validate-execution-guardrails.ps1 -ReportPath <REPORT_PATH> -AsJson",
          "passWhen": "reportMissingSections=0 and contains required sections"
        }
      ]
    },
    {
      "id": "GUARD-FOUNDATION-001",
      "kind": "guard",
      "title": "Production foundation guard (agent/workflow/skill alignment)",
      "status": "in_progress",
      "blocking": true,
      "scope": "codex_only",
      "owner": "codex",
      "checks": [
        {
          "command": "powershell -ExecutionPolicy Bypass -File Xuanzhi-Dev/testing/scripts/validate-agent-workflow-skill-foundation.ps1 -AsJson",
          "passWhen": "violations=0"
        }
      ]
    },
    {
      "id": "NEXT-E2E-CREATE-DAILY-USER",
      "kind": "workitem",
      "title": "create-daily-user real replay and state-closure verification",
      "status": "in_progress",
      "blocking": false,
      "scope": "xuanzhi_runtime",
      "owner": "agent-smith",
      "dependsOn": ["GUARD-PATH-001", "GUARD-VERIFY-001", "GUARD-REPORT-001", "GUARD-FOUNDATION-001"]
    },
    {
      "id": "NEXT-CODEX-FOUNDATION-GATE-EXPANSION",
      "kind": "workitem",
      "title": "foundation validator full-chain expansion for create/apply and mirror-drift checks",
      "status": "completed",
      "blocking": false,
      "scope": "codex_only",
      "owner": "codex",
      "dependsOn": ["GUARD-PATH-001", "GUARD-VERIFY-001", "GUARD-REPORT-001", "GUARD-FOUNDATION-001"]
    }
  ],
  "lastUpdated": "2026-03-23"
}
